<?xml version="1.0" encoding="UTF-8"?>
<StockPlanParticipant  xmlns="http://ns.hr-xml.org/2007-04-15" xmlns:xsi="http://www.w3.org/2001/XMLSchema-instance" xsi:schemaLocation="http://ns.hr-xml.org/2007-04-15
StockPlanParticipant.xsd">
	<Id>           
		<IdValue>541852258</IdValue>
	</Id>
	<Account>
		<IdValue>US88574112211</IdValue>
	</Account>
	<CompanyId>
		<IdValue>5542201100</IdValue>
	</CompanyId>
	<Name>
		<LegalName>John Doe</LegalName>
	</Name>
	<ContactInfo>
		<Telephone>
			<FormattedNumber>+01 810 654 6754</FormattedNumber>
		</Telephone>               
		<InternetEmailAddress>John.doe@company.com</InternetEmailAddress>
	</ContactInfo>
	<AdditionalInfo>            
		<DateOfBirth>1971-08-22</DateOfBirth>               
		<Nationality>US</Nationality>
		<HireDate>2000-01-02</HireDate>               
		<Employee>true</Employee>
		<Insider>true</Insider>
		<PercentOwner>7</PercentOwner>
		<WorkLocation validFrom="2001-10-10" validTo="2002-08-06">
			<CountryCode>DE</CountryCode>
			<Region>Hamburg</Region>
			<Municipality>Hamburg</Municipality>
		</WorkLocation>                
		<WorkLocation validFrom="2002-10-01" validTo="9999-12-31">
			<CountryCode>US</CountryCode>
			<Region>NY</Region>
			<Municipality>New York</Municipality>
			<PostalCode>95420</PostalCode>
		</WorkLocation>               
		<TaxInfo validFrom="2000-01-02">                   
			<TaxType>New York State Tax</TaxType>                   
			<TaxationLocation>
				<CountryCode>US</CountryCode>
				<Region>NY</Region>
				<Municipality>New York</Municipality>
				<PostalCode>95420</PostalCode> 
			</TaxationLocation>
			<Percentage>7</Percentage>                
		</TaxInfo>
	</AdditionalInfo>        
</StockPlanParticipant>